{
  "ansatz": "powerlaw_metrology",
  "ansatz_parameters": {
    "p": 0.0006
  },
  "determinism_note": "This file intentionally contains no timestamp; SHA-256 is a function only of the registered inputs.",
  "drift_table": [
    {
      "delta_v_diff_cm_s": -0.001129,
      "delta_v_gsc_cm_s": 0.922403,
      "delta_v_lcdm_cm_s": 0.923532,
      "rel_diff_percent": -0.1222,
      "same_sign_as_lcdm": true,
      "z": 0.1
    },
    {
      "delta_v_diff_cm_s": -0.004432,
      "delta_v_gsc_cm_s": 2.445509,
      "delta_v_lcdm_cm_s": 2.449941,
      "rel_diff_percent": -0.1809,
      "same_sign_as_lcdm": true,
      "z": 0.5
    },
    {
      "delta_v_diff_cm_s": -0.007695,
      "delta_v_gsc_cm_s": 2.159526,
      "delta_v_lcdm_cm_s": 2.167221,
      "rel_diff_percent": -0.355,
      "same_sign_as_lcdm": true,
      "z": 1.0
    },
    {
      "delta_v_diff_cm_s": -0.010764,
      "delta_v_gsc_cm_s": 1.081303,
      "delta_v_lcdm_cm_s": 1.092067,
      "rel_diff_percent": -0.9856,
      "same_sign_as_lcdm": true,
      "z": 1.5
    },
    {
      "delta_v_diff_cm_s": -0.013769,
      "delta_v_gsc_cm_s": -0.23076,
      "delta_v_lcdm_cm_s": -0.216991,
      "rel_diff_percent": -6.3455,
      "same_sign_as_lcdm": true,
      "z": 2.0
    },
    {
      "delta_v_diff_cm_s": -0.019627,
      "delta_v_gsc_cm_s": -2.941817,
      "delta_v_lcdm_cm_s": -2.922189,
      "rel_diff_percent": -0.6717,
      "same_sign_as_lcdm": true,
      "z": 3.0
    },
    {
      "delta_v_diff_cm_s": -0.025273,
      "delta_v_gsc_cm_s": -5.51924,
      "delta_v_lcdm_cm_s": -5.493967,
      "rel_diff_percent": -0.46,
      "same_sign_as_lcdm": true,
      "z": 4.0
    },
    {
      "delta_v_diff_cm_s": -0.030712,
      "delta_v_gsc_cm_s": -7.918015,
      "delta_v_lcdm_cm_s": -7.887303,
      "rel_diff_percent": -0.3894,
      "same_sign_as_lcdm": true,
      "z": 5.0
    }
  ],
  "framework_implications": {
    "kill_test": "A robust drift measurement inconsistent with the LCDM-class sign structure at z >= 2 falsifies T1/T2 exactly as it falsifies LCDM; no rescue is permitted.",
    "status": "P8 is a LCDM-degenerate consistency test: it can fail only if LCDM-class kinematics fail, and therefore carries no framework-specific discriminating power. It remains registered (forward: ELT/ANDES data unreleased) but is no longer described as a structural 'sign-flip' prediction anywhere in the package."
  },
  "lcdm_baseline": {
    "H0_km_s_Mpc": 67.4,
    "Omega_L": 0.685,
    "Omega_m": 0.315
  },
  "observation_interval_years": 10.0,
  "physics_status": "Computed from the registered T2 ansatz via the T2-consistent history H(z) = H_LCDM(z) * (1+z)^p (SigmaModulatedLCDMHistory), where p is the metrology exponent shared with P1. The r1 output used the v10.1 coasting toy H = H0 (1+z)^p, excluded at >100 sigma by the bundled DESI BAO and inconsistent with T1's LCDM equivalence; its 'positive drift at all z / sign flip' was an artefact of that toy. ELT/ANDES integration time `years` is the registered observation interval.",
  "prediction_id": "P8",
  "revision": "r2",
  "schema": "predictions_p8_pipeline_output_v2",
  "summary": {
    "all_same_sign_as_lcdm": true,
    "discriminating_power": "none at foreseeable precision: |delta_v_GSC - delta_v_LCDM| <= 0.03 cm/s at every grid point (relative deviation sub-percent away from LCDM's zero crossing near z ~ 2, where relative values are ill-defined); identical sign structure",
    "gsc_sign_flip_z_interval": [
      1.5,
      2.0
    ],
    "lcdm_sign_flip_z_interval": [
      1.5,
      2.0
    ],
    "max_abs_diff_cm_s": 0.030712,
    "max_abs_rel_diff_percent": 6.3455
  },
  "supersedes": {
    "file": "pipeline_output.r1_superseded.json",
    "history_used_by_r1": "PowerLawHistory H(z) = H0 (1+z)^p (coasting at p = 6e-4)",
    "reason": "r1's history is excluded by the framework's own bundled DESI DR1 BAO (+7 to +128 sigma per point) and contradicts T1's conformal equivalence to LCDM; the archived Roadmap v2.8 \u00a7E.1 had already shown positive drift at z > 2 is impossible for standard matter content (Omega_m0 > 1/(1+z)).",
    "revision": "r1",
    "sha256": "af2ef016bde6be60fe115e2dc2fb2640845331a77f179b75b6a009de3162d0fc"
  },
  "tier": "T2 (supporting only, not primary; no framework-specific discriminating power)",
  "title": "Redshift drift \u2014 \u039bCDM-degenerate consistency test at foreseeable precision (r2, v12.7)",
  "tool": "predictions_compute_P8",
  "tool_version": "v0.2"
}
